{
    "schema": "foil-lab/campaign-snapshot-v1",
    "schemaVersion": 1,
    "snapshotId": "SNAP-CAMP-WIND-BASELINE-001-v2",
    "generatedAt": "2026-09-20T03:20:00+02:00",
    "source": {
        "database": "foil_lab",
        "studyId": "STUDY-WIND-BASELINE-001",
        "campaignId": "CAMP-WIND-BASELINE-001"
    },
    "machine": {
        "machineId": "MACHINE-WIND-001",
        "revision": "2026-09-20.1",
        "technology": "EOLIEN",
        "status": "ACTIVE",
        "facts": [
            {
                "id": "WIND-002",
                "label": "reference test-scale power",
                "value": 2,
                "unit": "kW",
                "classification": "SOURCE_BACKED",
                "databricksPolicy": "CONTEXT_ONLY"
            },
            {
                "id": "WIND-003",
                "label": "experimental envelope",
                "value": "~1.5 x 1.5",
                "unit": "m",
                "classification": "SOURCE_BACKED",
                "databricksPolicy": "CONTEXT_ONLY"
            },
            {
                "id": "WIND-004",
                "label": "target TRL",
                "value": 5,
                "classification": "TARGET",
                "databricksPolicy": "DISPLAY_ONLY"
            },
            {
                "id": "BIZ-001",
                "label": "minimum program budget",
                "value": 700000,
                "unit": "EUR",
                "classification": "COMPANY_STATED",
                "databricksPolicy": "FINANCE_CONTEXT"
            },
            {
                "id": "CLAIM-001",
                "label": "disturbed/turbulent-flow productivity",
                "value": "+5-15% current working range; earlier +5-20%",
                "classification": "COMPANY_ESTIMATE",
                "databricksPolicy": "UNVALIDATED_BLOCKED_AS_MEASURED"
            },
            {
                "id": "CLAIM-008",
                "label": "farm/site density",
                "value": "conservative +25%; realistic objective +50-100%; literature up to x4",
                "classification": "COMPANY_ESTIMATE_AND_LITERATURE_CONTEXT",
                "databricksPolicy": "UNVALIDATED"
            }
        ],
        "parameters": [
            {
                "id": "wind_speed",
                "unit": "m/s",
                "classification": "MODEL_ASSUMPTION",
                "campaignCanOverride": true
            },
            {
                "id": "air_density",
                "unit": "kg/m3",
                "classification": "MODEL_ASSUMPTION",
                "campaignCanOverride": true
            },
            {
                "id": "turbulence_intensity",
                "unit": "%",
                "classification": "MODEL_ASSUMPTION",
                "campaignCanOverride": true
            },
            {
                "id": "foil_span",
                "unit": "m",
                "classification": "UNKNOWN_MODEL_ASSUMPTION",
                "campaignCanOverride": true
            },
            {
                "id": "foil_chord",
                "unit": "m",
                "classification": "UNKNOWN_MODEL_ASSUMPTION",
                "campaignCanOverride": true
            },
            {
                "id": "heave_amplitude",
                "unit": "m",
                "classification": "UNKNOWN_MODEL_ASSUMPTION",
                "campaignCanOverride": true
            },
            {
                "id": "pitch_amplitude",
                "unit": "deg",
                "classification": "UNKNOWN_MODEL_ASSUMPTION",
                "campaignCanOverride": true
            },
            {
                "id": "frequency",
                "unit": "Hz",
                "classification": "UNKNOWN_MODEL_ASSUMPTION",
                "campaignCanOverride": true
            },
            {
                "id": "phase",
                "unit": "deg",
                "classification": "UNKNOWN_MODEL_ASSUMPTION",
                "campaignCanOverride": true
            },
            {
                "id": "yaw",
                "unit": "deg",
                "classification": "UNKNOWN_MODEL_ASSUMPTION",
                "campaignCanOverride": true
            },
            {
                "id": "generator_efficiency",
                "unit": "%",
                "classification": "MODEL_ASSUMPTION",
                "campaignCanOverride": true
            },
            {
                "id": "availability",
                "unit": "%",
                "classification": "MODEL_ASSUMPTION",
                "campaignCanOverride": true
            }
        ],
        "unknowns": [
            "validated wind power curve",
            "measured Foil'O Wind Cp",
            "final commercial geometry",
            "exact foil profile/span/chord",
            "heave/pitch/yaw amplitude ranges",
            "machine mass/CG",
            "ballast/mooring architecture",
            "commercial CAPEX/OPEX",
            "certified loads/fatigue",
            "acoustic measurements"
        ],
        "controlContract": {
            "_id": "MACHINE-WIND-001@2026-09-20.1@control-v1",
            "kind": "lab_contract",
            "contractVersion": "1.0",
            "contractStatus": "CURRENT",
            "generatedAt": "2026-09-20",
            "machineId": "MACHINE-WIND-001",
            "revision": "2026-09-20.1",
            "technology": "EOLIEN",
            "classification": "CURATED_CONTROL_SNAPSHOT",
            "sourceHierarchy": {
                "currentStrategy": "SRC-STRATEGY-20260917",
                "technicalAnchor": "SRC-WIND-TECH-20260714",
                "currentWorkingDirection": "SRC-WIND-HAMBURG-20260917",
                "currentBusinessStatus": "SRC-WIND-FUNDING-20260820",
                "supportingProgram": [
                    "SRC-WIND-CITEPH-V3-20260603",
                    "SRC-CITEPH-20260523"
                ]
            },
            "sourceBackedContext": {
                "architecture": "active oscillating bi-foil fluid-flow energy converter",
                "referencePowerKw": {
                    "value": 2,
                    "qualifier": "approximately",
                    "policy": "CONTEXT_ONLY",
                    "factId": "WIND-002"
                },
                "experimentalEnvelopeM": {
                    "value": "~1.5 x 1.5",
                    "policy": "CONTEXT_ONLY",
                    "factId": "WIND-003",
                    "warning": "not final commercial geometry and not an exact span/stroke definition"
                },
                "targetTrl": {
                    "value": 5,
                    "qualifier": "approximately",
                    "policy": "DISPLAY_ONLY",
                    "factId": "WIND-004"
                },
                "architectureFeatures": [
                    "parametric kinematics",
                    "orientable pitch",
                    "constructive bi-foil interaction",
                    "natural balancing",
                    "two-in-one mechanical conversion",
                    "self-sustaining system",
                    "synchronous generator",
                    "adaptive control",
                    "energy control"
                ],
                "instrumentation": [
                    "loads",
                    "positions",
                    "frequency",
                    "power"
                ],
                "validationPlan": [
                    "representative conditions",
                    "mobile pre-tests",
                    "Pprime wind tunnel"
                ]
            },
            "parameterRegistry": [
                {
                    "id": "wind_speed",
                    "unit": "m/s",
                    "classification": "MODEL_ASSUMPTION",
                    "campaignCanOverride": true
                },
                {
                    "id": "air_density",
                    "unit": "kg/m3",
                    "classification": "MODEL_ASSUMPTION",
                    "campaignCanOverride": true
                },
                {
                    "id": "turbulence_intensity",
                    "unit": "%",
                    "classification": "MODEL_ASSUMPTION",
                    "campaignCanOverride": true
                },
                {
                    "id": "foil_span",
                    "unit": "m",
                    "classification": "UNKNOWN_MODEL_ASSUMPTION",
                    "campaignCanOverride": true
                },
                {
                    "id": "foil_chord",
                    "unit": "m",
                    "classification": "UNKNOWN_MODEL_ASSUMPTION",
                    "campaignCanOverride": true
                },
                {
                    "id": "heave_amplitude",
                    "unit": "m",
                    "classification": "UNKNOWN_MODEL_ASSUMPTION",
                    "campaignCanOverride": true
                },
                {
                    "id": "pitch_amplitude",
                    "unit": "deg",
                    "classification": "UNKNOWN_MODEL_ASSUMPTION",
                    "campaignCanOverride": true
                },
                {
                    "id": "frequency",
                    "unit": "Hz",
                    "classification": "UNKNOWN_MODEL_ASSUMPTION",
                    "campaignCanOverride": true
                },
                {
                    "id": "phase",
                    "unit": "deg",
                    "classification": "UNKNOWN_MODEL_ASSUMPTION",
                    "campaignCanOverride": true
                },
                {
                    "id": "yaw",
                    "unit": "deg",
                    "classification": "UNKNOWN_MODEL_ASSUMPTION",
                    "campaignCanOverride": true
                },
                {